<!ELEMENT book_detail (Books*)>
<!ELEMENT Books (book,author,year,publisher)>
<!ELEMENT book (#PCDATA)>
<!ATTLIST book title (XML|DCN) #IMPLIED>
<!ELEMENT author (#PCDATA)>
<!ELEMENT year (#PCDATA)>
<!ELEMENT publisher (#PCDATA)>

